{
  "schema_version": "1.0",
  "paper_id": "BENCH-05-QUANTUM-SUPREMACY-ABLATION",
  "source_sha256": "6f3030abb7d9d4f0624a5cbe5ca2ff673df63afc85c97fadd0bf7db780c8dbaf",
  "narrative_markdown": "# Quantum supremacy using a programmable superconducting processor — 直接精读\n\n## 实验问题\n论文问能否在真实超导处理器上制备足够大的、足够低错误率的量子态，并选择一个对量子处理器容易而对经典计算机难的任务。Google 的 Sycamore 芯片原有 54 个 transmon qubits，其中一个不可用，实验使用 53 个 qubits，对应 2^53、约 9×10^15 维 Hilbert 空间。任务是随机量子电路采样，而不是 Shor 等通用算法；作者的结论是对这个特定 sampling 任务实现了 quantum supremacy。\n\n## 硬件、任务与验证量\n处理器是二维最近邻可调耦合阵列，运行 25 ns 单比特微波脉冲和 12 ns 双比特 iSWAP-like 门。随机电路每个 cycle 同时施加单比特 X/Y/W 门和按 ABCD 等 pattern 排列的双比特门，通过增加 qubit width 与 depth 制造经典模拟困难。核心指标是 linear cross-entropy benchmarking fidelity，F_XEB = 2〈P(x_i)〉−1，其中 P(x_i) 是理想电路对观测 bitstring 的概率；无误差时接近 1，均匀采样接近 0。完整 supremacy 电路不能直接经典模拟，因此论文用可分解 patch circuits、部分纠缠的 elided circuits 和同门数但更易模拟的 verification circuits 交叉验证。\n\n## 器件与主要结果\n孤立/同时运行的平均单比特错误率为 0.15%/0.16%，双比特门为 0.36%/0.62%，双比特 cycle 为 0.65%/0.93%，readout 为 3.1%/3.8%。最大 53-qubit 随机电路包含 1,113 个单比特门、430 个双比特门和 53 次测量，基于组件错误率预测总 fidelity 为 0.2%。对 53 qubits、20 cycles 的最复杂 elided circuits，30 million samples 得到 F_XEB=(2.24±0.21)×10^-3，并以 5σ 置信度断言平均 fidelity 大于 0.1%。图 4 显示 patch/elided/verification 之间的一致性；量子处理器采集一百万样本约 200 秒，而作者依据 Summit/Google 的经典模拟和外推估计同等 fidelity 的经典采样约需一万年（按一百万 cores 的口径），验证完整电路还要更久。\n\n## 证据边界与批判性阅读\n实验支持的是随机电路采样任务上的硬件速度差，而非“量子计算全面超越经典”或所有有用算法均已加速。10,000 年是对特定电路、特定 fidelity、当时经典算法和资源假设的估计；论文承认算法改进可能降低成本，并以 elided/patch 近似推断未直接验证的完整电路。数字化误差模型的关键假设是低相关、局部 Pauli 错误；组件 fidelity 的乘积与验证曲线相符，但大系统外推仍依赖误差独立和模型适用。论文还指出 fault-tolerant logical qubits、Shor/Grover 和实用应用仍需重大工程进展。因而最强的直接结论是：Sycamore 在 2019 年构造并统计验证了一个可重复的、特定随机电路采样基准，达到当时已知经典模拟方法难以匹敌的规模；更广泛的计算优越性尚未由该实验单独建立。",
  "notes": "Real Host Agent Direct-AI reading of the original source PDF only; no Evidentia artifacts, project context, or Research Memory were supplied."
}
