{
  "schema_version": "1.0",
  "paper_id": "BENCH-03-REMOTE-SENSING-FOREST",
  "source_sha256": "0e94f20b028c82a3d74df6d966a0b93ee4f1d063c71e8c63c359aefb560d5a82",
  "narrative_markdown": "# A high-resolution canopy height model of the Earth — 直接精读\n\n## 研究问题与数据融合\n论文要解决的是全球、连续且高分辨率地获得植被冠层高度。GEDI 全波形激光雷达提供垂直结构的高质量参考，但只覆盖南北纬 51.6°以内的稀疏足迹，天然不能形成全球 10 m 壁到壁产品；Sentinel-2 光学影像覆盖密集、重访频繁，却不能直接测量垂直结构。作者将二者融合：用 GEDI RH98 冠层顶高作为稀疏监督，用 Sentinel-2 的 12 个 L2A 光谱波段和循环编码地理坐标预测每个 10 m 像素的冠层高度与方差。\n\n## 模型与训练\n模型是一个不下采样的全卷积残差网络，使用可分离 3×3 卷积；为全球部署缩小为 8 个 block、每个 block 256 个 filter。每个输入是 15×15 像素 patch，输出与输入同空间尺度的均值和方差。训练样本来自 2019/2020 年 4—8 月 GEDI 足迹周围 Sentinel-2 影像，全球约 600 million 个样本；按 100×100 km Sentinel-2 tile 划分，20% tile 留作空间验证，避免随机像素划分过于乐观。作者同时使用按 1 m 高度频率倒数加权以减轻低矮植被过多造成的偏差，并训练五个不同初始化的 CNN ensemble。推理时对一年内十个观测日期融合，方差用于逆方差加权。\n\n## 主要结果\n图 1 的 held-out GEDI 评估显示，按 5 m 高度区间平衡的平均 RMSE 为 7.3 m、平均偏差为 −1.8 m；不平衡总体验证 RMSE 为 6.0 m、偏差为 1.3 m。模型改善了传统冠层高度在 25—30 m 附近的饱和问题，但不同 biome 的偏差并不一致，mangrove、tundra 和 tropical coniferous forest 平均过估计约 2.5 m。独立 LVIS 空中激光雷达的 12 个区域上 RMSE 为 7.8 m、ME 为 0.6 m；GEDI 范围外区域 RMSE 为 4.7 m、ME 为 1.6 m，GEDI 范围内为 8.8 m、ME 为 0.2 m。按图 2/3 的全球部署结果，5 m 以上植被覆盖约 41% 陆地、10 m 以上约 30%、30 m 以上约 5%；30 m 以上冠层约 34% 位于保护区。\n\n## 不确定性、产品与限制\n每个 CNN 通过 Gaussian likelihood 同时估计均值和 aleatoric variance，ensemble spread 表示 epistemic uncertainty。预测不确定度与实际误差相关；过滤掉最不确定的 20% 像素后，整体 RMSE 从 6.0 m 降至 5.2 m、偏差从 1.3 m 降至 1.0 m，但代价是完整性降低。全球制图处理约 1.3×10^12 像素、160 TB Sentinel-2 数据，需要约 27,000 GPU-hours。论文明确限定了结论：名义 10 m GSD 不等于 10 m 有效空间分辨率，GEDI 约 25 m 足迹、稀疏监督和地理配准误差使小尺度冠层变化被平滑；云覆盖和高纬 tile 边界会产生伪影，低不确定度区域的 calibration 也可能恶化，且 tundra 参考数据稀少并含异常值。结果支持在训练分布相关条件下开展全球、年度、带不确定度的冠层高度制图，但不等于对所有生态区和细粒度结构都达到同等准确度。",
  "notes": "Real Host Agent Direct-AI reading of the original source PDF only; no Evidentia artifacts, project context, or Research Memory were supplied."
}
